{"schemaVersion":1,"unit":"thousand tonnes","years":[2015,2016,2017,2018,2019,2020,2021,2022,2023,2024,2025],"latestYear":2025,"cargoGroups":["Liquid Bulk","Dry Bulk","Containers","Ro-Ro Self Propelled","Ro-Ro Non-Self Propelled","Other General Cargo"],"regions":["European Union (excl. United Kingdom)","Other Europe (excl. European Union) & Mediterranean","Africa (excl. Mediterranean)","America","Asia (excl. Mediterranean)","Australasia","United Kingdom (inc CHI & IOM)","Unspecified"],"domesticRegion":"United Kingdom (inc CHI & IOM)","unspecifiedRegion":"Unspecified","agricultural":{"category":23,"label":"Agricultural products (eg grain, soya, tapioca)","group":"Dry Bulk"},"notes":["Note 2: Unspecified routes are those where the port of load/unload has not been supplied by data providers or where the port of load/unload is an offshore installation in international waters.","Note 3: Data for roll-on/roll-off traffic for Hull in 2019 has been revised.","Note 4: Data for container (lo-lo) and roll-on/roll-off traffic for London from 2019 to 2023 has been revised.","Note 5: In 2025, freight traffic data on two new cargo type breakdowns were collected from major UK ports: wood pellets (previously categorised as ‘other dry bulk’) and wind farm products (previously categorised as ‘other general cargo’). Totals for ‘other dry bulk’ and ‘other general cargo’ will appear lower in 2025 due to this cargo recategorisation.","Note 6: Due to data system changes at a large operator at London, some cargo category 2025 figures for roll-on/roll-off (ro-ro) are not aligned with previous years. This does not affect the total figure for all ro-ro traffic, only 'Road goods vehicles with or without accompanying trailers', 'Unaccompanied road goods trailers and semi-trailers' and 'Rail wagons, shipborne port-to-port trailers and shipborne barges' which are estimated by the operator. DfT are reviewing these figures with the operator, and they will likely be revised in the next release."],"method":"DfT PORT0499 (major ports, port level) summed by port, year, direction, cargo group and region of the port of load (inwards). A year in which a port reported nothing to DfT's major-port statistics is null, not zero. Ports included: the 51 major ports with data in 2025. Locations: DfT's rough location where it gives one, otherwise EMODnet's main-port location for the same UN/LOCODE.","ports":[{"locode":"GBLON","name":"London","nation":"England","point":[-0.0728,51.50694],"location":{"source":"dft","detail":"DfT port list: rough location for mapping"},"years":[2015,2016,2017,2018,2019,2020,2021,2022,2023,2024,2025],"inwardsByRegion":{"European Union (excl. United Kingdom)":[17680.511,20988.057,19920.495,20742.541,18822.092,17757.983,19428.916,22182.136,20452.697,19727.383,20948.557],"Other Europe (excl. European Union) & Mediterranean":[3935.429,4910.137,5298.081,6592.338,6604.743,5790.663,6760.6,4397.224,4042.721,3758.378,3262.207],"Africa (excl. Mediterranean)":[670.77,659.668,483.763,965.732,1028.871,685.733,828.543,811.73,796.915,909.763,1614.866],"America":[1898.313,1869.374,2178.542,3328.683,3927.014,2930.933,2819.713,3352.384,3440.91,4762.701,4123.491],"Asia (excl. Mediterranean)":[2650.189,4030.858,3454.402,3661.133,4193.181,2377.133,2251.097,4366.435,4500.93,5505.805,8090.493],"Australasia":[913.944,563.898,705.527,364.034,352.871,287.51,296.403,247.168,400.75,273.677,302.25],"United Kingdom (inc CHI & IOM)":[10565.478,10130.785,10215.198,9116.174,9523.547,8561.911,10653.573,10025.368,9362.072,8047.332,7042.656],"Unspecified":[0.0,0.0,0.0,0.0,0.0,0.934,0.91,0.82,5.726,256.919,1.388]},"inwardsByGroup":{"Liquid Bulk":[11629.068,14949.673,14534.188,15040.309,14402.909,9831.214,10178.714,12715.49,13051.993,13233.43,13310.086],"Dry Bulk":[12270.565,13104.304,13794.177,13035.911,13577.053,12236.654,14878.088,14030.342,13187.438,11853.111,10917.549],"Containers":[6925.406,8118.085,6849.939,9199.619,9394.139,9298.812,8884.782,9371.714,8322.369,9116.674,12122.728],"Ro-Ro Self Propelled":[585.756,633.975,577.215,564.336,548.619,407.667,391.527,475.456,579.287,676.511,2283.83],"Ro-Ro Non-Self Propelled":[5319.567,5236.212,5306.405,5469.133,5178.426,5549.507,7345.191,7293.698,6701.727,7238.368,5532.648],"Other General Cargo":[1584.271,1110.529,1194.083,1461.329,1351.172,1068.947,1361.453,1496.566,1159.906,1123.864,1219.066]},"agriculturalInwardsByRegion":{"European Union (excl. United Kingdom)":[209.553,196.895,240.897,203.504,318.08,271.756,586.965,487.517,618.69,631.659,764.537],"Other Europe (excl. European Union) & Mediterranean":[116.917,49.565,143.418,87.196,0.0,40.647,0.0,34.53,53.239,44.424,52.684],"Africa (excl. Mediterranean)":[25.299,73.256,40.765,163.135,190.389,135.954,149.782,102.127,86.697,121.61,173.167],"America":[540.443,595.466,461.021,566.148,459.503,521.192,493.564,605.647,563.618,553.693,582.732],"Asia (excl. Mediterranean)":[0.0,29.494,0.0,0.0,0.0,0.0,17.483,30.337,0.0,29.588,6.014],"Australasia":[78.509,40.692,70.133,15.823,59.379,57.635,69.045,0.0,131.429,42.743,0.0],"United Kingdom (inc CHI & IOM)":[98.931,69.904,48.071,77.814,122.365,38.889,73.952,92.028,117.209,120.231,117.965],"Unspecified":[0.0,0.0,0.0,0.0,0.0,0.0,0.0,0.0,0.0,0.0,0.0]},"outwards":[7115.787,7227.288,7612.389,8425.409,9582.412,8964.988,8733.027,9496.739,8592.688,8627.17,11198.41]},{"locode":"GBIMM","name":"Grimsby & Immingham","nation":"England","point":[-0.19328,53.63054],"location":{"source":"dft","detail":"DfT port list: rough location for mapping"},"years":[2015,2016,2017,2018,2019,2020,2021,2022,2023,2024,2025],"inwardsByRegion":{"European Union (excl. United Kingdom)":[18955.882,19154.559,18478.584,20540.2,19797.454,18245.535,19067.834,19831.907,16890.579,18635.895,17751.34],"Other Europe (excl. European Union) & Mediterranean":[7290.307,5408.664,6837.687,7199.113,6657.444,3686.748,5702.924,3914.825,2817.2,2119.691,2309.321],"Africa (excl. Mediterranean)":[963.017,353.94,881.313,848.74,326.592,138.128,277.154,908.355,737.48,643.128,669.836],"America":[10968.525,9793.374,7735.592,8942.096,6780.433,7548.904,8296.671,7952.94,8479.361,6918.931,8833.166],"Asia (excl. Mediterranean)":[453.566,684.456,658.942,724.115,638.871,346.2,432.751,607.455,959.756,722.641,541.677],"Australasia":[289.252,536.921,880.554,899.508,578.598,302.481,223.98,975.89,327.038,0.0,207.126],"United Kingdom (inc CHI & IOM)":[4663.178,2943.725,2126.667,2512.109,3110.398,1764.605,1868.419,1120.977,1496.205,1404.284,920.149],"Unspecified":[0.0,0.001,0.0,0.0,19.43,0.029,0.237,0.078,0.018,0.062,0.022]},"inwardsByGroup":{"Liquid Bulk":[12551.005,11316.773,10948.021,12246.458,11905.397,7217.969,9630.604,8010.11,8705.358,8346.999,6215.225],"Dry Bulk":[18126.983,14499.315,13366.143,15893.468,12579.343,11604.603,12539.537,13306.293,9946.169,8735.73,11072.795],"Containers":[1467.117,1699.71,1946.459,1832.264,1781.852,1837.176,2404.125,1779.442,1542.417,1690.874,2009.853],"Ro-Ro Self Propelled":[2126.995,1984.935,2088.03,2168.398,2174.875,1682.2,1509.1,1711.086,1912.147,1913.245,2118.749],"Ro-Ro Non-Self Propelled":[8618.029,8466.141,8412.139,8609.307,8669.762,8759.853,8873.816,9881.874,9026.545,9202.138,9280.05],"Other General Cargo":[693.598,908.767,838.547,915.986,797.992,930.831,912.787,623.619,575.001,555.646,535.964]},"agriculturalInwardsByRegion":{"European Union (excl. United Kingdom)":[481.211,65.547,96.847,27.531,62.598,164.313,109.032,132.514,63.993,102.888,118.625],"Other Europe (excl. European Union) & Mediterranean":[58.258,14.804,20.34,1.032,8.057,31.626,10.084,28.043,0.0,56.463,35.719],"Africa (excl. Mediterranean)":[0.0,0.0,0.0,0.0,0.0,0.0,0.0,0.0,0.0,0.0,5.874],"America":[78.787,0.0,200.413,43.336,0.0,26.402,22.791,54.422,119.049,63.76,181.242],"Asia (excl. Mediterranean)":[0.0,0.0,0.0,0.0,0.0,0.0,0.0,0.0,0.0,0.0,0.0],"Australasia":[0.0,0.0,0.0,0.0,0.0,0.0,0.0,0.0,0.0,0.0,0.0],"United Kingdom (inc CHI & IOM)":[7.836,0.0,0.0,0.0,0.0,0.0,0.0,3.882,0.0,0.0,1.907],"Unspecified":[0.0,0.0,0.0,0.0,0.0,0.0,0.0,0.0,0.0,0.0,0.0]},"outwards":[15519.075,15527.82,16434.485,13951.101,13336.136,13578.549,14157.257,14853.586,14263.146,13273.411,13641.986]},{"locode":"GBMLF","name":"Milford Haven","nation":"Wales","point":[-5.01372,51.7052],"location":{"source":"dft","detail":"DfT port list: rough location for mapping"},"years":[2015,2016,2017,2018,2019,2020,2021,2022,2023,2024,2025],"inwardsByRegion":{"European Union (excl. United Kingdom)":[2229.047,2015.933,2265.394,2730.436,2316.961,2377.04,2274.686,3856.994,2499.033,1822.555,3068.892],"Other Europe (excl. European Union) & Mediterranean":[8562.919,7404.374,8014.565,6271.005,5589.533,3619.536,5978.64,4595.599,4098.691,4291.851,3721.347],"Africa (excl. Mediterranean)":[917.882,1227.403,212.109,847.823,947.209,536.964,1056.395,2201.651,2352.102,1561.896,2101.444],"America":[3141.853,3024.476,3903.24,5523.593,5901.81,7029.579,4230.637,9377.64,10942.871,10668.858,14829.794],"Asia (excl. Mediterranean)":[8814.18,7772.059,5375.156,3455.398,8500.497,8245.585,6138.106,6227.55,2938.998,3114.951,2444.388],"Australasia":[43.678,0.0,0.0,0.0,0.0,0.0,0.0,0.0,0.0,0.0,0.0],"United Kingdom (inc CHI & IOM)":[2723.534,1944.469,475.613,399.368,735.51,1929.841,971.957,1350.312,1382.029,1076.137,917.912],"Unspecified":[0.0,0.0,0.0,0.0,0.0,0.0,0.0,90.527,0.0,0.0,0.0]},"inwardsByGroup":{"Liquid Bulk":[25903.571,22779.094,19675.477,18638.607,23496.178,23207.794,20116.564,27232.159,23828.93,22090.576,26635.622],"Dry Bulk":[60.283,86.503,83.364,73.524,41.742,64.943,52.109,46.318,33.883,55.903,29.755],"Containers":[0.0,0.0,0.0,0.0,0.0,0.0,0.0,0.0,0.0,0.0,0.0],"Ro-Ro Self Propelled":[222.241,234.818,224.373,222.047,199.501,193.836,169.665,144.748,137.717,133.845,130.756],"Ro-Ro Non-Self Propelled":[246.935,288.3,262.812,293.444,254.1,266.841,312.083,277.047,213.194,255.924,287.644],"Other General Cargo":[0.063,0.0,0.05,0.0,0.0,5.132,0.0,0.0,0.0,0.0,0.0]},"agriculturalInwardsByRegion":{"European Union (excl. United Kingdom)":[36.743,37.028,0.0,0.0,0.0,0.0,0.0,0.0,